### ISSUE TITLE
Multi outlet devices

### ISSUE THREAD

**Issue by anandsuppiah12** [mattsaxon/sonoff-lan-mode-homeassistant#4]
> Multi outlets devices

>However, I am very confident that if your device works with the eWeLink app in LAN Mode, we can get it working with this component - we might need a bit of joint investigation (e.g. tcpdump of communication from app) first to get it working!

Hi. Refer to the above. I have a sonoff 3 gang switch and a ifan03. What information do you need to get it working.

**Comment by mattsaxon** [comment]
Here is an example data blob for a multi-outlet device.

data: b'{"sledOnline":"on","configure":[{"startup":"off","outlet":0},{"startup":"off","outlet":1},{"startup":"off","outlet":2},{"startup":"off","outlet":3}],"pulses":[{"pulse":"off","width":1000,"outlet":0},{"pulse":"off","width":1000,"outlet":1},{"pulse":"off","width":1000,"outlet":2},{"pulse":"off","width":1000,"outlet":3}],"switches":[{"switch":"off","outlet":0},{"switch":"off","outlet":1},{"switch":"off","outlet":2},{"switch":"off","outlet":3}]}'

This gives me enough information to get it reporting status. I suspect I may be able to guess the codes to operate it too.

The properties header allows you to see it is a multi-outlet device too

properties: {b'txtvers': b'1', b'id': b'10004ea43b', b'type': b'strip', b'apivers': b'1', b'seq'.......

**Comment by anandsuppiah12** [comment]
I hope this will help
`
2019-08-31 20:11:05 DEBUG (zeroconf-ServiceBrowser__ewelink._tcp.local.) [homeassistant.components.switch.sonoff_lan_mode_r3] service is at 192.168.1.64:8081
2019-08-31 20:11:05 DEBUG (MainThread) [homeassistant.components.switch.sonoff_lan_mode_r3] enter handle_mesage()
2019-08-31 20:11:05 DEBUG (zeroconf-ServiceBrowser__ewelink._tcp.local.) [homeassistant.components.switch.sonoff_lan_mode_r3] properties: {b'txtvers': b'1', b'id': b'10004ea43b', b'type': b'strip', b'apivers': b'1', b'seq': b'135', b'encrypt': True, b'iv': b'Nzc4MjMwMDc1MDMxODY3Nw==', b'data1': b'16KC3RzZItvIOD99vfNE01ssovyKOlAv/fJ811JgUSj9lBE47USeIwpuZAUMsKTlPc3ZEG5nMuGeKWCdlPyTOZhRi9K2G3losZlmeBNAEYE4wr6UCFRZOBU/6nLycavFbkTG2gFtkDmJt7H0yEvRPDey/s9Cy60QS35D5UfwcfkNenkUjiqOyzOMGqrBJxiueJd70oUKe1Km4czcKIa7X6GAKz+XRYt4pbMqVTrI/McFbcabUAfhBwP96', b'data2': b'fjH8RySieHQ0SG7npfxLueTYCfGMeULEiTMHw3EiBSI9fMBG9aKK/RJ4p+mGjrJlp/1hln6Rs7p5LJ0NetFXnXx5kgS/FVZX4EojaUryKjro6K+dCFh9+sdz1Rit0hV5wtckMdSjQuWjzHAnJHEttg4eEUKCyu8C8kJTmXeVsYlofxdTFzYKnq9bLHtVt0MDSSMRF5APqlizf1iiEd7dskMygXTDRZTIfqNF0WM53FCCu6wtUIa8JUbsk', b'data3': b'gr/FArRFvmNJYhg8D4fzvXtLgYw+NYRACuTMzmgLS5NJWK/9iFm02DUsVCeo6O81mroSXZliy3RjovMWz1ajMpYUyWvCgp2NmWOg=='}
2019-08-31 20:11:06 ERROR (MainThread) [homeassistant.components.switch.sonoff_lan_mode_r3] Unknown message received from device: 
2019-08-31 20:11:06 DEBUG (zeroconf-ServiceBrowser__ewelink._tcp.local.) [homeassistant.components.switch.sonoff_lan_mode_r3] decrypted data: b'{"sledOnline":"on","configure":[{"startup":"off","outlet":0},{"startup":"off","outlet":1},{"startup":"off","outlet":2},{"startup":"off","outlet":3}],"pulses":[{"pulse":"off","width":1000,"outlet":0},{"pulse":"off","width":1000,"outlet":1},{"pulse":"off","width":1000,"outlet":2},{"pulse":"off","width":1000,"outlet":3}],"switches":[{"switch":"off","outlet":0},{"switch":"off","outlet":1},{"switch":"off","outlet":2},{"switch":"off","outlet":3}]}'
2019-08-31 20:11:06 DEBUG (MainThread) [homeassistant.components.switch.sonoff_lan_mode_r3] enter handle_mesage()
2019-08-31 20:11:06 ERROR (MainThread) [homeassistant.components.switch.sonoff_lan_mode_r3] Unknown message received from device: 
2019-08-31 20:26:13 DEBUG (zeroconf-ServiceBrowser__ewelink._tcp.local.) [homeassistant.components.switch.sonoff_lan_mode_r3] message to send (plaintext): {'sequence': '1567254373', 'deviceid': '10004ea43b', 'selfApikey': '123', 'data': None}
2019-08-31 20:26:13 DEBUG (zeroconf-ServiceBrowser__ewelink._tcp.local.) [homeassistant.components.switch.sonoff_lan_mode_r3] encrypted: {'sequence': '1567254373', 'deviceid': '10004ea43b', 'selfApikey': '123', 'data': '', 'encrypt': True, 'iv': 'j4K4FtO2l7kwPwc9FcdFQw=='}
2019-08-31 20:26:13 DEBUG (zeroconf-ServiceBrowser__ewelink._tcp.local.) [homeassistant.components.switch.sonoff_lan_mode_r3] Sending http message to http://192.168.1.64:8081/zeroconf/signal_strength: {'sequence': '1567254373', 'deviceid': '10004ea43b', 'selfApikey': '123', 'data': '', 'encrypt': True, 'iv': 'j4K4FtO2l7kwPwc9FcdFQw=='} 
2019-08-31 20:31:20 INFO (zeroconf-ServiceBrowser__ewelink._tcp.local.) [homeassistant.components.switch.sonoff_lan_mode_r3] Service eWeLink_10004ea43b._ewelink._tcp.local. removed
2019-08-31 20:31:20 DEBUG (zeroconf-ServiceBrowser__ewelink._tcp.local.) [homeassistant.components.switch.sonoff_lan_mode_r3] enter close_connection()
`

**Comment by mattsaxon** [comment]
Thanks

What I could use in addition is the message when you activate one of the T1 switches from eWeLink. If you could do that this will be great, however I will need you to share your api_key if you are prepared to do that do I can decrypt the message.

To get the message you need to trace at the LAN level. I use tcpdump on an OpenWRT router, but there are other ways too.

**Comment by anandsuppiah12** [comment]
I apologize i'm not a techie. I realize that tcpdump cannot be installed on windows. My router cannot be flashed with OpenWRT. the windows equivalent, windump doesn't seem to work on win10. Looks like my only way forward is installing ubuntu on vm. is there an easier way to do this?

**Comment by mattsaxon** [comment]
Thanks you for considering all these ways. Let me see how far I can get with what information you’ve provided. I may be able to take an educated guess at what the message may be based on the information you’ve provided.

**Comment by mattsaxon** [comment]
If you wanted to have a crack at the trace, i suspect the easiest way for you would be to install a different tracing tool on your Windows 10 machine and set it up as a wireless access point. Then you would reconfigure your phone eWeLink to connect direct to the Windows device rather than your WiFi router. The tool of choice is probably Wireshark, but is fairly complex to use (any trace tool). The trace would be large unless you filtered it, ideally by the devices IP address (which you should be able to see in the debit log you’ve already sent). No problem if you don’t want to have a go, I’m happy to try a bit of trail and error first.

**Comment by anandsuppiah12** [comment]
Hi. I got it. Is there a way for me to send you privately. I'm afraid there may be personal info / security issues with posting it in public

**Comment by mattsaxon** [comment]
Happy for you to send it to my email address, saxonmatt@hotmail.com

**Comment by anandsuppiah12** [comment]
Sent it already. Hope it is sufficient

**Comment by mattsaxon** [comment]
Latest code has a draft improvement for multi-outlet.....

1. It will almost certainly work to no longer show unavailable, but instead should show status of the first outlet

2. Hopefully it might also switch the first outlet

3. Sorry it definitely wont to all of the outlets yet, that will require a bit more work to sort out, lets see if this update improves the situation first.

@anandsuppiah12, can you please test?

**Comment by anandsuppiah12** [comment]
Hi. Thanks for the update. Will test it tonight

**Comment by mattsaxon** [comment]
@anandsuppiah12, any news on the testing?

**Comment by kamihentay** [comment]
@mattsaxon , Hi.
I collected tcpdump data on the T2EU switch 3 channels.
I hope this helps your library support this switch as soon as possible.

I am ready to conduct tests and give additional information.
I’ll send the api key to your mail.

CH1 ON:
`22:07:44.772885 IP iPhone-Kami.Router.60836 > ESP_D8C0A8.tproxy: Flags [S], seq 714659792, win 65535, options [mss 1460,nop,wscale 7,nop,nop,TS val 823304045 ecr 0,sackOK,eol], length 0
E..@..@.@...............*..........................
1..m........
22:07:44.900981 IP iPhone-Kami.Router.60836 > ESP_D8C0A8.tproxy: Flags [.], ack 1873035, win 65535, length 0
E..(..@.@...............*.......P....T..
22:07:44.901546 IP iPhone-Kami.Router.60836 > ESP_D8C0A8.tproxy: Flags [P.], seq 0:315, ack 1, win 65535, length 315
E..c..@.@..\............*.......P....]..POST /zeroconf/switches HTTP/1.1
Host: 192.168.1.203:8081
Content-Type: application/json;charset=UTF-8
User-Agent: ewelinkDemo/1 CFNetwork/1107.1 Darwin/19.0.0
Connection: keep-alive
Accept: application/json
Accept-Language: ru
Content-Length: 225
Accept-Encoding: gzip, deflate
Cache-Control: no-store


22:07:44.901598 IP iPhone-Kami.Router.60836 > ESP_D8C0A8.tproxy: Flags [P.], seq 315:540, ack 1, win 65535, length 225
E..	..@.@...............*.......P.......{"sequence":"1569438464795","deviceid":"10008c4276","selfApikey":"3d0df888-8045-4aad-aa75-945b4ff35c68","iv":"OTM3ODYzODUwMDMxMTk4MQ==","encrypt":true,"data":"lALf7mGEp0UzEjCf5Fm0+91o/Ph3qhjClXsKi1m0GlgJOb4Tn1tgi/j1QJfZJdxp"}
22:07:44.969916 IP iPhone-Kami.Router.60836 > ESP_D8C0A8.tproxy: Flags [.], ack 173, win 65535, length 0
E..(..@.@...............*......7P.......
22:07:44.970036 IP iPhone-Kami.Router.60836 > ESP_D8C0A8.tproxy: Flags [F.], seq 540, ack 173, win 65535, length 0
E..(..@.@...............*......7P.......
22:07:44.973600 IP iPhone-Kami.Router.60836 > ESP_D8C0A8.tproxy: Flags [.], ack 174, win 65535, length 0
E..(..@.@...............*......8P.......
`

CH1 OFF:
`22:07:05.261654 IP iPhone-Kami.Router.60830 > ESP_D8C0A8.tproxy: Flags [S], seq 3543281026, win 65535, options [mss 1460,nop,wscale 7,nop,nop,TS val 823264600 ecr 0,sackOK,eol], length 0
E..@..@.@................2-.........ns.............
1..X........
22:07:05.344026 IP iPhone-Kami.Router.60830 > ESP_D8C0A8.tproxy: Flags [.], ack 1850425, win 65535, length 0
E..(..@.@................2-...<9P....`..
22:07:05.345793 IP iPhone-Kami.Router.60830 > ESP_D8C0A8.tproxy: Flags [P.], seq 0:315, ack 1, win 65535, length 315
E..c..@.@..\.............2-...<9P....j..POST /zeroconf/switches HTTP/1.1
Host: 192.168.1.203:8081
Content-Type: application/json;charset=UTF-8
User-Agent: ewelinkDemo/1 CFNetwork/1107.1 Darwin/19.0.0
Connection: keep-alive
Accept: application/json
Accept-Language: ru
Content-Length: 225
Accept-Encoding: gzip, deflate
Cache-Control: no-store


22:07:05.346353 IP iPhone-Kami.Router.60830 > ESP_D8C0A8.tproxy: Flags [P.], seq 315:540, ack 1, win 65535, length 225
E..	..@.@................2....<9P...z...{"sequence":"1569438425273","deviceid":"10008c4276","selfApikey":"3d0df888-8045-4aad-aa75-945b4ff35c68","iv":"MjI1MzYyMzA5MTYxMjYwNQ==","encrypt":true,"data":"gvUOdwktQZaJrz6Tr7D7TizzRP4ldvED2iJGiukF7D4iItIgEDpR184ivspKLigO"}
22:07:05.359298 IP iPhone-Kami.Router.60830 > ESP_D8C0A8.tproxy: Flags [.], ack 173, win 65535, length 0
E..(..@.@................2/...<.P.......
22:07:05.359840 IP iPhone-Kami.Router.60830 > ESP_D8C0A8.tproxy: Flags [F.], seq 540, ack 173, win 65535, length 0
E..(..@.@................2/...<.P.......
22:07:05.363844 IP iPhone-Kami.Router.60830 > ESP_D8C0A8.tproxy: Flags [.], ack 174, win 65535, length 0
E..(..@.@................2/...<.P.......
`
CH 2 ON:
`22:08:27.129691 IP Ferret.Router.domain > ESP_D8C0A8.4096: 58233 1/0/0 A 52.57.6.180 (52)
E..P..@.@............5...<.j.y...........eu-disp.coolkit.cc..............a..49..
22:08:31.824908 IP iPhone-Kami.Router.60847 > ESP_D8C0A8.tproxy: Flags [S], seq 116673690, win 65535, options [mss 1460,nop,wscale 7,nop,nop,TS val 823351025 ecr 0,sackOK,eol], length 0
E..@..@.@.................L........................
1.V.........
22:08:31.871007 IP iPhone-Kami.Router.60847 > ESP_D8C0A8.tproxy: Flags [.], ack 1941379, win 65535, length 0
E..(..@.@.................L.....P...++..
22:08:31.871783 IP iPhone-Kami.Router.60847 > ESP_D8C0A8.tproxy: Flags [P.], seq 0:315, ack 1, win 65535, length 315
E..c..@.@..\..............L.....P...W4..POST /zeroconf/switches HTTP/1.1
Host: 192.168.1.203:8081
Content-Type: application/json;charset=UTF-8
User-Agent: ewelinkDemo/1 CFNetwork/1107.1 Darwin/19.0.0
Connection: keep-alive
Accept: application/json
Accept-Language: ru
Content-Length: 225
Accept-Encoding: gzip, deflate
Cache-Control: no-store


22:08:31.871841 IP iPhone-Kami.Router.60847 > ESP_D8C0A8.tproxy: Flags [P.], seq 315:540, ack 1, win 65535, length 225
E..	..@.@.................M.....P.......{"sequence":"1569438511840","deviceid":"10008c4276","selfApikey":"3d0df888-8045-4aad-aa75-945b4ff35c68","iv":"ODk1MTg4MjA1ODgyNDY5Nw==","encrypt":true,"data":"1IN1PGwG3W4OffrqMDQror/Dj6B8TwqbJFSqtv8vf6Fjx61v0vwml/ew5uy2GwRP"}
22:08:31.886586 IP iPhone-Kami.Router.60847 > ESP_D8C0A8.tproxy: Flags [.], ack 173, win 65535, length 0
E..(..@.@.................N..../P...(c..
22:08:31.887166 IP iPhone-Kami.Router.60847 > ESP_D8C0A8.tproxy: Flags [F.], seq 540, ack 173, win 65535, length 0
E..(..@.@.................N..../P...(b..
22:08:31.890327 IP iPhone-Kami.Router.60847 > ESP_D8C0A8.tproxy: Flags [.], ack 174, win 65535, length 0
E..(..@.@.................N....0P...(a..`

CH 2 OFF:
`22:10:29.784020 IP iPhone-Kami.Router.60863 > ESP_D8C0A8.tproxy: Flags [S], seq 3202381585, win 65535, options [mss 1460,nop,wscale 7,nop,nop,TS val 823468857 ecr 0,sackOK,eol], length 0
E..@..@.@.................w..........1.............
1.#9........
22:10:29.835431 IP iPhone-Kami.Router.60863 > ESP_D8C0A8.tproxy: Flags [.], ack 2149028, win 65535, length 0
E..(..@.@.................w.. ..P.......
22:10:29.836563 IP iPhone-Kami.Router.60863 > ESP_D8C0A8.tproxy: Flags [P.], seq 0:315, ack 1, win 65535, length 315
E..c..@.@..\..............w.. ..P...I...POST /zeroconf/switches HTTP/1.1
Host: 192.168.1.203:8081
Content-Type: application/json;charset=UTF-8
User-Agent: ewelinkDemo/1 CFNetwork/1107.1 Darwin/19.0.0
Connection: keep-alive
Accept: application/json
Accept-Language: ru
Content-Length: 225
Accept-Encoding: gzip, deflate
Cache-Control: no-store


22:10:29.837067 IP iPhone-Kami.Router.60863 > ESP_D8C0A8.tproxy: Flags [P.], seq 315:540, ack 1, win 65535, length 225
E..	..@.@.................xM. ..P...."..{"sequence":"1569438629790","deviceid":"10008c4276","selfApikey":"3d0df888-8045-4aad-aa75-945b4ff35c68","iv":"MzQ2NTU4MDcxMzIxNTIzNg==","encrypt":true,"data":"Gl6pvYB7xL9b+Ljg/5iIry9ba7YInCgAxJRy5ti1YHBV812y/Vj9ThTfzcd3r0Hd"}
22:10:29.848125 IP iPhone-Kami.Router.60863 > ESP_D8C0A8.tproxy: Flags [.], ack 173, win 65535, length 0
E..(..@.@.................y.. .PP.......
22:10:29.848683 IP iPhone-Kami.Router.60863 > ESP_D8C0A8.tproxy: Flags [F.], seq 540, ack 173, win 65535, length 0
E..(..@.@.................y.. .PP.......
22:10:29.852200 IP iPhone-Kami.Router.60863 > ESP_D8C0A8.tproxy: Flags [.], ack 174, win 65535, length 0
E..(..@.@.................y/. .QP.......
`
CH 3 ON:
`22:11:26.930322 IP iPhone-Kami.Router.60867 > ESP_D8C0A8.tproxy: Flags [S], seq 3907715460, win 65535, options [mss 1460,nop,wscale 7,nop,nop,TS val 823525971 ecr 0,sackOK,eol], length 0
E..@..@.@..........................................
1..S........
22:11:26.974592 IP iPhone-Kami.Router.60867 > ESP_D8C0A8.tproxy: Flags [.], ack 2218379, win 65535, length 0
E..(..@.@....................!..P...Z)..
22:11:26.975120 IP iPhone-Kami.Router.60867 > ESP_D8C0A8.tproxy: Flags [P.], seq 0:315, ack 1, win 65535, length 315
E..c..@.@..\.................!..P....2..POST /zeroconf/switches HTTP/1.1
Host: 192.168.1.203:8081
Content-Type: application/json;charset=UTF-8
User-Agent: ewelinkDemo/1 CFNetwork/1107.1 Darwin/19.0.0
Connection: keep-alive
Accept: application/json
Accept-Language: ru
Content-Length: 225
Accept-Encoding: gzip, deflate
Cache-Control: no-store


22:11:26.975971 IP iPhone-Kami.Router.60867 > ESP_D8C0A8.tproxy: Flags [P.], seq 315:540, ack 1, win 65535, length 225
E..	..@.@....................!..P...0...{"sequence":"1569438686911","deviceid":"10008c4276","selfApikey":"3d0df888-8045-4aad-aa75-945b4ff35c68","iv":"OTkyMTQ4Nzg5NzI5MjY2Ng==","encrypt":true,"data":"Uuh5aklz+Fbwabp1r+c8vWAk54G78IVi/BG6LaFWCHH6uf8q6bOT+FYJJpx/KO6B"}
22:11:26.987921 IP iPhone-Kami.Router.60867 > ESP_D8C0A8.tproxy: Flags [.], ack 173, win 65535, length 0
E..(..@.@....................!.7P...Wa..
22:11:26.988547 IP iPhone-Kami.Router.60867 > ESP_D8C0A8.tproxy: Flags [F.], seq 540, ack 173, win 65535, length 0
E..(..@.@....................!.7P...W`..
22:11:26.991700 IP iPhone-Kami.Router.60867 > ESP_D8C0A8.tproxy: Flags [.], ack 174, win 65535, length 0
E..(..@.@....................!.8P...W_..`

CH 3 OFF:

`22:11:48.693933 IP iPhone-Kami.Router.60871 > ESP_D8C0A8.tproxy: Flags [S], seq 3309482227, win 65535, options [mss 1460,nop,wscale 7,nop,nop,TS val 823547724 ecr 0,sackOK,eol], length 0
E..@..@.@................B.........................
1.WL........
22:11:48.786005 IP iPhone-Kami.Router.60871 > ESP_D8C0A8.tproxy: Flags [.], ack 2334000, win 65535, length 0
E..(..@.@................B...#.0P...
...
22:11:48.787422 IP iPhone-Kami.Router.60871 > ESP_D8C0A8.tproxy: Flags [P.], seq 0:315, ack 1, win 65535, length 315
E..c..@.@..\.............B...#.0P...6...POST /zeroconf/switches HTTP/1.1
Host: 192.168.1.203:8081
Content-Type: application/json;charset=UTF-8
User-Agent: ewelinkDemo/1 CFNetwork/1107.1 Darwin/19.0.0
Connection: keep-alive
Accept: application/json
Accept-Language: ru
Content-Length: 225
Accept-Encoding: gzip, deflate
Cache-Control: no-store


22:11:48.788821 IP iPhone-Kami.Router.60871 > ESP_D8C0A8.tproxy: Flags [P.], seq 315:540, ack 1, win 65535, length 225
E..	..@.@................B./.#.0P....4..{"sequence":"1569438708702","deviceid":"10008c4276","selfApikey":"3d0df888-8045-4aad-aa75-945b4ff35c68","iv":"MDc1NDg1NDU5NDk1OTU3OA==","encrypt":true,"data":"eHiBBjFLHDoFf3yat7R6396F4cqy6n7YmqBfN+eqzmXs0b/08xIOF5TM86gCQ7Rv"}
22:11:48.800126 IP iPhone-Kami.Router.60871 > ESP_D8C0A8.tproxy: Flags [.], ack 173, win 65535, length 0
E..(..@.@................B...#..P.......
22:11:48.801220 IP iPhone-Kami.Router.60871 > ESP_D8C0A8.tproxy: Flags [F.], seq 540, ack 173, win 65535, length 0
E..(..@.@................B...#..P.......
22:11:48.803841 IP iPhone-Kami.Router.60871 > ESP_D8C0A8.tproxy: Flags [.], ack 174, win 65535, length 0
E..(..@.@................B...#..P.......
`

**Comment by mattsaxon** [comment]
Many thanks for this, though I am still waiting for last patch that I posted to be tested. Can you test this and report if the multi channel devices are recognised and no longer marked as unavailable?

**Comment by kamihentay** [comment]
@mattsaxon, I do not quite understand how to correctly add this switch to the configuration file.
I add:

> `
> switch:
> - platform: sonoff_lan_mode_r3
>     name: Test3Ch
>     device_id: 10008c4276
>.    host: 192.168.1.203
>     api_key: MY_API_KEY
>     icon: mdi:lightbulb`


I see this switch in HA, but only 1 channel, and that one does not work...


In HA, the switch fulfills, but in reality, the light does not turn on on any of the channels

**Comment by clapbr** [comment]
> Many thanks for this, though I am still waiting for last patch that I posted to be tested. Can you test this and report if the multi channel devices are recognised and no longer marked as unavailable?

I have tested the latest code in the .zip file with the cli tool.
```
~/extras/sonoff_lan_mode_r3 >>> python cli.py -l DEBUG --device_id 10009f6f50 --api_key 'xxxxxxxxxxxxxxxxxxxxxxxxxxxxxxxxx' state              
2019-11-06 16:45:49,679 - info: Initialising SonoffSwitch with host None
2019-11-06 16:45:49,679 - debug: Initializing SonoffLANModeClient class in SonoffDevice
2019-11-06 16:45:49,679 - debug: enter send_availability_loop()
2019-11-06 16:45:49,679 - debug: waiting for connection
2019-11-06 16:45:49,680 - debug: send_updated_params_loop is active on the event loop
2019-11-06 16:45:49,680 - debug: Starting loop waiting for device params to change
2019-11-06 16:45:49,680 - debug: send_updated_params_loop now awaiting event
2019-11-06 16:45:49,761 - info: Service type _ewelink._tcp.local. of name eWeLink_10009f6f50._ewelink._tcp.local. added
2019-11-06 16:45:49,762 - debug: service is at 192.168.0.11:8081
2019-11-06 16:45:49,762 - debug: properties: {b'txtvers': b'1', b'id': b'10009f6f50', b'type': b'strip', b'apivers': b'1', b'seq': b'66', b'encrypt': True, b'iv': b'MDk1MzcwNzkxNDY5MTk1Mw==', b'data1': b'CBoOvT8Q7OP08bF+zwN+Zq7lPWzxYyR2wVDOTc2k27xn8T9kSO4OfVQz1XQweyyFmwmDHbyBtkdEiS7QHlU9g0q1i1PidL+Sj/P6yf7cz8O4QIzkpmom9lRCzP9Bu07x4yhiPoGKh6cyagtfNKi9eU4CxR9i5eWKHcUyIZqtUzMbf/l0+9HfdBiWfIB9HFjeiqUzX+3Fd5XgOiu7rY6LbhIP9TZPJUnPsj7p7GlV0dUE/s0XsCW/Ktj7B', b'data2': b'Gjr8NRGAS9W89D1tcYAlVd+W+gRORIawZlgkE4WdVq3BRjVokplQUxT4Yx2qnwjulNbZ6tumtILqkbYH1k85ieiHJ7eWCPGUMNOfQmEYLwaipi6zXgypl6lNp1um+XcyTOS+L6dJngy0B/jWaoQjegKqYckhY0yzAHgyvR5b6rlUlLzs+MyHjxq9CZbqhtI57bOx4/JgWahozw1XBAeiytwCCzPLJUAqA6dahPNbG5qrlnr+SThBliDOL', b'data3': b'kNIH9EcH8lWGM7c2vf35Js/7QDohAkRe3Z6nvaKBwfEKOLBTG7I4ZDiO+RCKtwNwEdr6KuXBUBKmIuLpx9lXsdb/CCA4eoFGu2OA=='}
2019-11-06 16:45:49,762 - debug: type: b'strip'
2019-11-06 16:45:49,765 - debug: decrypted data: b'{"sledOnline":"on","configure":[{"startup":"off","outlet":0},{"startup":"off","outlet":1},{"startup":"off","outlet":2},{"startup":"off","outlet":3}],"pulses":[{"pulse":"off","width":1000,"outlet":0},{"pulse":"off","width":1000,"outlet":1},{"pulse":"off","width":1000,"outlet":2},{"pulse":"off","width":1000,"outlet":3}],"switches":[{"switch":"off","outlet":0},{"switch":"off","outlet":1},{"switch":"off","outlet":2},{"switch":"off","outlet":3}]}'
2019-11-06 16:45:49,765 - debug: enter handle_mesage()
2019-11-06 16:45:49,765 - debug: Message: Received status from device, storing in instance
2019-11-06 16:45:49,765 - info: unsolicited update received from switch: off
2019-11-06 16:45:49,765 - debug: Switch update pre-callback filter running
2019-11-06 16:45:49,765 - debug: Not inching switch, calling parent callback
2019-11-06 16:45:49,765 - info: == Device: 10009f6f50 (None) ==
2019-11-06 16:45:49,765 - info: State: OFF
2019-11-06 16:45:49,765 - debug: shutdown_event_loop called
2019-11-06 16:45:49,765 - debug: exiting send_availability_loop()
2019-11-06 16:45:49,765 - debug: send_updated_params_loop cancelled
2019-11-06 16:45:49,766 - debug: send_updated_params_loop finally block reached
```

listen commands updates one of the outlets and the other shows up as unsolicited.

```
2019-11-06 16:58:49,258 - info: Initialising SonoffSwitch with host None
2019-11-06 16:58:49,258 - debug: Initializing SonoffLANModeClient class in SonoffDevice
2019-11-06 16:58:49,259 - debug: enter send_availability_loop()
2019-11-06 16:58:49,259 - debug: waiting for connection
2019-11-06 16:58:49,259 - debug: send_updated_params_loop is active on the event loop
2019-11-06 16:58:49,259 - debug: Starting loop waiting for device params to change
2019-11-06 16:58:49,259 - debug: send_updated_params_loop now awaiting event
2019-11-06 16:58:49,340 - info: Service type _ewelink._tcp.local. of name eWeLink_10009f6f50._ewelink._tcp.local. added
2019-11-06 16:58:49,341 - debug: service is at 192.168.0.11:8081
2019-11-06 16:58:49,341 - debug: properties: {b'txtvers': b'1', b'id': b'10009f6f50', b'type': b'strip', b'apivers': b'1', b'seq': b'68', b'encrypt': True, b'iv': b'OTc4MTUzNjI2NDQxMjQ2Nw==', b'data1': b'y5132kKVG4iOfwy6V6lU7xENdrtFCXVX1Wosjp4dQAPbIiNl4XKHhwLsSG7v72JEyjmMFURHsPuAX+j7KSGA8Pjaa/pM353H5KhSqaRMHMVnrwcqMFc8NDj0vD2wT1MB3aWSjpwiFDBF1XGXc95W8mBrC/OSurVGacmOuLx+cDWlOmgUb83EhZMfIvwV0JGOp0X7/9VNfwVXB6XT/NO8bB0peOYHFVnM+YEJvp5RPEkeXLQ4dkk/IMK5N', b'data2': b'HokCrw4oXY5P1TBQTntR0qZKt9Nw1OsO2BGXCAO2NbqaCTIkRi1PmgWBsyxQR3A+6nGdI9QShNBlHFAsSheXETXh2u4ZODS/GA9eE0Tw8jYq2MNqvzcAKyKUwkxMQIFOLzVew5pHl8QfpIyKRrCjBBY2wAn8o8n/fRAKFWoginHmdhY3P60AabrWWuggic4SIbsDFnzvGZS0NFqy7UfjwivzCSERs+3O47SY8+RXL1twtSCunzsL5g5Tf', b'data3': b'YhwB7NCS6W37GJUiW//Xu1oIOCd9TQyDTQTVEVVm4vIt7ksavWcu1M2QqIVvi/+tRa3XmGRsb3BQa00bUsdCTHctKnv/h2hGzczA=='}
2019-11-06 16:58:49,341 - debug: type: b'strip'
2019-11-06 16:58:49,343 - debug: decrypted data: b'{"sledOnline":"on","configure":[{"startup":"off","outlet":0},{"startup":"off","outlet":1},{"startup":"off","outlet":2},{"startup":"off","outlet":3}],"pulses":[{"pulse":"off","width":1000,"outlet":0},{"pulse":"off","width":1000,"outlet":1},{"pulse":"off","width":1000,"outlet":2},{"pulse":"off","width":1000,"outlet":3}],"switches":[{"switch":"on","outlet":0},{"switch":"off","outlet":1},{"switch":"off","outlet":2},{"switch":"off","outlet":3}]}'
2019-11-06 16:58:49,344 - debug: enter handle_mesage()
2019-11-06 16:58:49,344 - debug: Message: Received status from device, storing in instance
2019-11-06 16:58:49,344 - info: unsolicited update received from switch: on
2019-11-06 16:58:49,344 - debug: Switch update pre-callback filter running
2019-11-06 16:58:49,344 - debug: Not inching switch, calling parent callback
2019-11-06 16:58:49,344 - info: == Device: 10009f6f50 (None) ==
2019-11-06 16:58:49,344 - info: State: ON
2019-11-06 16:58:49,344 - info: Listening for updates forever... Press CTRL+C to quit.
2019-11-06 16:58:49,344 - debug: connected event, sending update
2019-11-06 16:58:49,344 - debug: Switch update pre-callback filter running
2019-11-06 16:58:49,344 - debug: Not inching switch, calling parent callback
2019-11-06 16:58:49,344 - info: == Device: 10009f6f50 (None) ==
2019-11-06 16:58:49,344 - info: State: ON
2019-11-06 16:58:49,344 - debug: waiting for disconnection
2019-11-06 16:58:56,172 - debug: properties: {b'txtvers': b'1', b'id': b'10009f6f50', b'type': b'strip', b'apivers': b'1', b'seq': b'69', b'encrypt': True, b'iv': b'MTQ0ODcyNTExMTY5MTI0MA==', b'data1': b'fZCB0ZeOek6CBY1rYITPvosoHme/vfsHm3+6aJkWZeuYQKM/QBWPAeHB4xk3NPndLa8WBkq9W4nxTPdC2jPJ9lDjti4gluwraQQ0FI31r5olcRtJCFsFWBC0yUotyWAq2DvidNlI2UehBXeMXCrwavFcn+UlKrd98sBbnIsCexUaoySA3S43kN/9m7Pkk7CIxo6EGdDYPwDYg4f/YZc3dwZ8VAMXI6BnkavojptTCy+xasvxE4FcLyrqw', b'data2': b'FsCY054qmctv/OHlnL+w4EmEnHFGKL8kAtrCJquF4hKPwzdSlbRXeSxULJsbzkq/eARC7xyk7W/BBS4dGp3hkyGnCxjZ1Hjql+RgBzcGx24S7wSXm0n7beIjdS6fxJvBprI7SfhxZhKA/vI7ND3FCawrCjAq6hQHhp6DOEN71uDvO9VX4W1O4IX/PQm1WHuqSwZEpgKz6nqx9CExZ36szSa+Cr+J+xkEFih/EpA2+LM5PmoXVwGIgnIXV', b'data3': b'XEsnLW4R7WXOymI1W69Q9QvOMjpLpS8XqPGmAsLAN2zcm1KICxS/+o5jqFskyeOcAdGtFMQ1lw1kH0Q0eqohy/UarapSMFQwEVww=='}
2019-11-06 16:58:56,172 - debug: type: b'strip'
2019-11-06 16:58:56,172 - debug: decrypted data: b'{"sledOnline":"on","configure":[{"startup":"off","outlet":0},{"startup":"off","outlet":1},{"startup":"off","outlet":2},{"startup":"off","outlet":3}],"pulses":[{"pulse":"off","width":1000,"outlet":0},{"pulse":"off","width":1000,"outlet":1},{"pulse":"off","width":1000,"outlet":2},{"pulse":"off","width":1000,"outlet":3}],"switches":[{"switch":"on","outlet":0},{"switch":"on","outlet":1},{"switch":"off","outlet":2},{"switch":"off","outlet":3}]}'
2019-11-06 16:58:56,172 - debug: enter handle_mesage()
2019-11-06 16:58:56,172 - debug: Message: Received status from device, storing in instance
2019-11-06 16:58:56,173 - info: unsolicited update received from switch: on
2019-11-06 16:59:15,653 - debug: properties: {b'txtvers': b'1', b'id': b'10009f6f50', b'type': b'strip', b'apivers': b'1', b'seq': b'70', b'encrypt': True, b'iv': b'MTIxNDMzMTgyMDY0MTM2Ng==', b'data1': b'XaWpeTJByGNpDBnfNku4g5OMJqGR/UR48sVyTk3t/67EiEpJeCFym4sEWcMdra2TTNUyUckKlIr/qHFKxKjYejzqV+JDYjDpeV05bOXJ24Fy8gTc5/7rD3GlbBzdCTiEYFo1XO/MjHohi7bAKzvHpdYbXparXRV4nRQLEu/jLDRJQDfhHQGFDoiRMikFHvEZaxGKtiL/H/64cr3w3znVnp/8dYPvfff0L8YoxVZ0dMkfNTD6142wAEVDL', b'data2': b'O+HPHXEAFN/jeQgj+uTtV+lXjiaW2HjriYY0f8BGRiZKFw2nI9XVa9BSgcCTAtn0fI98xceETu7xqbs3loQZCDCaefoDvwgHHwhA1oKA9IOkBoF4SxXbKeYnlwak6rSBVaQxl3W97ce3bpRTGdqPztKMHgSF8Eaahqxpyy/dxiC4BZdkyzmSOx5/8K3kuXbW8cvCWOIa/Tmt5AxxSv64InJwto+OXCtPBAKSSWuqAPYjdwmROZ2qFdu6V', b'data3': b'Tkzm5BmBX6hXmYNWQmbeEmZrd4WJz250tO/ZUXvliV0BnAqdnqqnjSFCL5QqVjEnsFl4V+/YmGo8QzT7hg4PwxNDsoRAdBZiahHg=='}
2019-11-06 16:59:15,653 - debug: type: b'strip'
2019-11-06 16:59:15,654 - debug: decrypted data: b'{"sledOnline":"on","configure":[{"startup":"off","outlet":0},{"startup":"off","outlet":1},{"startup":"off","outlet":2},{"startup":"off","outlet":3}],"pulses":[{"pulse":"off","width":1000,"outlet":0},{"pulse":"off","width":1000,"outlet":1},{"pulse":"off","width":1000,"outlet":2},{"pulse":"off","width":1000,"outlet":3}],"switches":[{"switch":"on","outlet":0},{"switch":"off","outlet":1},{"switch":"off","outlet":2},{"switch":"off","outlet":3}]}'
2019-11-06 16:59:15,654 - debug: enter handle_mesage()
2019-11-06 16:59:15,654 - debug: Message: Received status from device, storing in instance
2019-11-06 16:59:15,654 - info: unsolicited update received from switch: on
```
Everyhing looks correct, just seems a matter of properly handling them in the internal logic. I have only 2 outlets though so we might also need a way to manually specify we want 1-4 switches.

**Comment by pablomainieri** [comment]
Hello.
I check all the threat of the multi outlet. This is the same for ifan03 I understand.
Someone make this works? We have the hardware ready for test, the ifan003 its not flashes, its original, set in lan mode and any recommendation to set speeds would be more that appreciated!
Thanks!

**Comment by mattsaxon** [comment]
@clapbr thanks for testing. Yes I'll add the extra parameter to specify the outlet. Probably have a chance to do this over the xmas break i'd imagine. Sorry everyone for the delay!

**Comment by mattsaxon** [comment]
@pablomainieri no idea on the ifan03 I'm afraid.

**Comment by mattsaxon** [comment]
@kamihentay you dont need to specify the host and deviceid, just deviceid should suffice. Please retest and tell me your findings

**Comment by mattsaxon** [comment]
@kamihentay thanks for the information (that you sent sometime ago)

I've decrypted it and confirmed that the correct messages to send to the device are;

b'{"switches":[{"outlet":0,"switch":"on"}]}'
b'{"switches":[{"outlet":0,"switch":"off"}]}'
b'{"switches":[{"outlet":1,"switch":"on"}]}'
b'{"switches":[{"outlet":1,"switch":"off"}]}'
b'{"switches":[{"outlet":2,"switch":"on"}]}'
b'{"switches":[{"outlet":2,"switch":"off"}]}'

**Comment by mattsaxon** [comment]
I have checked my code and it looks like it is sending the correct code. @kamihentay or anyone, can you test please?

At the moment, the code only switches on/off the first outlet ("0"). If someone can confirm this is working that would be great. Otherwise, please send the appropriate parts of the HA debug log.

**Comment by mattsaxon** [comment]
New code added that supports the config entry to specify which outlet is used

e.g. 
> outlet: 0

If you have multi-outlet devices you need to repeat the configuration as many times as you have outlets with a different outlet number on each configuration.

Outlets are number starting at 0, so for 4 channel devices, you will have one with 0, 1, 2, 3.

Please test and get back to me as I don't yet have a multi-outlet device

**Comment by clapbr** [comment]
Tthanks for taking this Matt, unfortunately I can't test further because I migrated to Tasmota.

**Comment by tsouza85** [comment]
I use latest sonoff_lan_mode_r3.zip from master branch with switch.py (latest) from root repo...

Config (switchs.yaml):
```
- platform: sonoff_lan_mode_r3
  name: ifan02 Outlet 0
  device_id: 100065d0d6
  api_key: !secret ventilador_sala_api_key
  outlet: 0
- platform: sonoff_lan_mode_r3
  name: ifan02 Sala Outlet 1
  device_id: 100065d0d6
  api_key: !secret ventilador_sala_api_key
  outlet: 1
- platform: sonoff_lan_mode_r3
  name: ifan02 Sala Outlet 2
  device_id: 100065d0d6
  api_key: !secret ventilador_sala_api_key
  outlet: 2
- platform: sonoff_lan_mode_r3
  name: ifan02 Sala Outlet 3
  device_id: 100065d0d6
  api_key: !secret ventilador_sala_api_key
  outlet: 3
```

Log (debug): https://pastebin.com/c80kYxC3

**Comment by mattsaxon** [comment]
Thanks @tsouza85, it would be useful to
Know what the behaviour is. Are all 4 switches appearing? Do they appear as available? When you switch them, what happens?

**Comment by tsouza85** [comment]
@mattsaxon, Appear but are unavailable all switchs!

**Comment by mattsaxon** [comment]
Updated code posted, please try again

**Comment by tsouza85** [comment]
I tried again but it didn't work! Still unavailable

Logs: https://pastebin.com/dCMSah6q

**Comment by mattsaxon** [comment]
I've posted later code with better error handling, but this will just give a better log i'm afraid, would you mind testing again and sending revised log.

**Comment by tsouza85** [comment]
New log:
https://pastebin.com/AF3YTUU1

I used new zip with switch.py from zip file.
switch.py ​​from zip file does not need to be updated?

Because:

> 2019-12-31 10:05:32 ERROR (MainThread) [homeassistant.config] Invalid config for [switch.sonoff_lan_mode_r3]: [outlet] is an invalid option for [switch.sonoff_lan_mode_r3]. Check: switch.sonoff_lan_mode_r3->outlet. (See /config/switchs.yaml, line 18). Please check the docs at https://home-assistant.io/integrations/sonoff_lan_mode_r3/
> 2019-12-31 10:05:32 ERROR (MainThread) [homeassistant.config] Invalid config for [switch.sonoff_lan_mode_r3]: [outlet] is an invalid option for [switch.sonoff_lan_mode_r3]. Check: switch.sonoff_lan_mode_r3->outlet. (See /config/switchs.yaml, line 23). Please check the docs at https://home-assistant.io/integrations/sonoff_lan_mode_r3/
> 2019-12-31 10:05:32 ERROR (MainThread) [homeassistant.config] Invalid config for [switch.sonoff_lan_mode_r3]: [outlet] is an invalid option for [switch.sonoff_lan_mode_r3]. Check: switch.sonoff_lan_mode_r3->outlet. (See /config/switchs.yaml, line 28). Please check the docs at https://home-assistant.io/integrations/sonoff_lan_mode_r3/
> 2019-12-31 10:05:32 ERROR (MainThread) [homeassistant.config] Invalid config for [switch.sonoff_lan_mode_r3]: [outlet] is an invalid option for [switch.sonoff_lan_mode_r3]. Check: switch.sonoff_lan_mode_r3->outlet. (See /config/switchs.yaml, line 33). Please check the docs at https://home-assistant.io/integrations/sonoff_lan_mode_r3/

**Comment by mattsaxon** [comment]
Sorry, my mistake, yes there should be a new switch.py too. I've uploaded now. Please try again.

p.s. my 4CH Pro should shortly be arriving in the post, so I should be able to get it working shortly without this need for you to constantly test!

**Comment by mattsaxon** [comment]
My 4CH has just arrived. Latest code appears as available with it, and updates the status in HA if the device is switched. 

However the switching from HA is not working, so I will investigate and post a fix when I work out what the problem is.

**Comment by tsouza85** [comment]
> Sorry, my mistake, yes there should be a new switch.py too. I've uploaded now. Please try again.
> 
> p.s. my 4CH Pro should shortly be arriving in the post, so I should be able to get it working shortly without this need for you to constantly test!

No problem, I test as often as necessary. It is a way of contributing to project.



> My 4CH has just arrived. Latest code appears as available with it, and updates the status in HA if the device is switched.
> 
> However the switching from HA is not working, so I will investigate and post a fix when I work out what the problem is.

I tested it now and the same thing happened...

Log: https://pastebin.com/MM3jtj54

**Comment by mattsaxon** [comment]
Fixed in latest code
